{
  "contract_version": 1,
  "protocol_version": 2,
  "operation_id": "toolop-example-001",
  "task_id": "task-example-001",
  "subtask_id": "subtask-example-001",
  "call_id": "call-example-001",
  "source": "gateway",
  "target_id": "pi-studio:mac-001",
  "tool_name": "local.read",
  "ok": true,
  "result": {
    "path": "README.md",
    "content": "# Demo\n",
    "bytes": 7,
    "encoding": "utf-8"
  },
  "error": null
}
